{
  "$comment": "Auto-generated by scripts/build-architecture-snapshot.py. Source-of-truth for downstream agents that need to ground catalog facts in the curated kombify-StackKits contracts. Do not hand-edit — re-run the script after modifying the CUE.",
  "schema_version": "3.1.0",
  "generated_at": "2026-10-16T06:15:44Z",
  "source": {
    "repo": "kombifyio/stackKits",
    "ref": "main",
    "commit": "f3ab1ada4f4a5c390896fa599eeefc2ecb7a86a8"
  },
  "placement_model": {
    "axis": "placementMode",
    "modes": [
      "local-only",
      "standard",
      "managed-serverless"
    ],
    "sub_dimensions": {
      "exposure": [
        "private",
        "public"
      ],
      "coupling": [
        "cloudless",
        "coupled"
      ]
    },
    "oss_realized": [
      "local-only",
      "standard+cloudless"
    ],
    "control_plane_only": [
      "standard+coupled",
      "managed-serverless"
    ],
    "note": "OSS publishes eligibility; realization of coupled/managed-serverless lives in the Control-Plane catalog (kombify-DB sk_*), never in OSS.",
    "source_standard": "public StackKits standards/PLACEMENT-MODE-STANDARD.md@v1.1"
  },
  "stackkits": [
    {
      "slug": "basement-kit",
      "display_name": "Basement Kit",
      "description": "Local-first StackKit for one or more nodes on private home sites",
      "version": "5.1.0",
      "topology": {
        "allowed_site_kinds": [
          "home"
        ],
        "required_site_kinds": [
          "home"
        ],
        "min_sites": 1,
        "max_sites": 1,
        "multi_node": true,
        "control_plane_default_mode": "single",
        "control_plane_allowed_modes": [
          "single",
          "warm-standby",
          "quorum"
        ]
      },
      "capabilities": {
        "required": [
          "topology-core",
          "host-bootstrap",
          "external-host-admission",
          "host-conformance",
          "security-baseline",
          "human-identity-core",
          "device-trust-core",
          "access-policy",
          "runtime-paas",
          "service-catalog",
          "secrets-recovery",
          "storage-data-policy",
          "backup-core",
          "observability-evidence",
          "lifecycle-update",
          "site-local",
          "local-ingress",
          "lan-access-policy",
          "lan-dns",
          "device-enrollment-home",
          "local-control-authority",
          "offline-autonomy",
          "local-backup-target",
          "local-backup-runtime",
          "home-host-security"
        ],
        "defaults": [],
        "optional": [
          "lan-discovery",
          "internal-pki",
          "private-remote-access",
          "public-publish-egress",
          "encrypted-offsite-backup",
          "telemetry-collection",
          "basement-compose-runtime",
          "availability-ha"
        ],
        "forbidden": [
          "site-cloud",
          "cloud-control-authority",
          "inter-site-link"
        ]
      },
      "contexts": [],
      "source_path": "basement-kit/stackfile.cue"
    },
    {
      "slug": "cloud-kit",
      "display_name": "Cloud Kit",
      "description": "Cloud-only StackKit for one or more externally supplied cloud hosts",
      "version": "5.1.0",
      "topology": {
        "allowed_site_kinds": [
          "cloud"
        ],
        "required_site_kinds": [
          "cloud"
        ],
        "min_sites": 1,
        "max_sites": 1,
        "multi_node": true,
        "control_plane_default_mode": "single",
        "control_plane_allowed_modes": [
          "single",
          "warm-standby",
          "quorum"
        ]
      },
      "capabilities": {
        "required": [
          "topology-core",
          "host-bootstrap",
          "external-host-admission",
          "host-conformance",
          "security-baseline",
          "human-identity-core",
          "device-trust-core",
          "access-policy",
          "runtime-paas",
          "service-catalog",
          "secrets-recovery",
          "storage-data-policy",
          "backup-core",
          "observability-evidence",
          "lifecycle-update",
          "site-cloud",
          "cloud-core-runtime",
          "host-local-internet-firewall",
          "public-edge",
          "public-dns",
          "public-tls",
          "internet-host-hardening",
          "remote-owner-bootstrap",
          "cloud-control-authority"
        ],
        "defaults": [],
        "optional": [
          "private-admin-mesh",
          "offsite-object-backup",
          "failure-domain-placement",
          "telemetry-collection",
          "availability-ha"
        ],
        "forbidden": [
          "site-local",
          "lan-discovery",
          "local-ingress",
          "lan-access-policy",
          "device-enrollment-home"
        ]
      },
      "contexts": [],
      "source_path": "cloud-kit/stackfile.cue"
    },
    {
      "slug": "modern-homelab",
      "display_name": "Modern Homelab",
      "description": "Federated local and cloud StackKit with a policy-constrained bridge",
      "version": "1.1.0-alpha",
      "topology": {
        "allowed_site_kinds": [
          "home",
          "cloud"
        ],
        "required_site_kinds": [
          "home",
          "cloud"
        ],
        "min_sites": 2,
        "max_sites": 64,
        "multi_node": true,
        "control_plane_default_mode": "single",
        "control_plane_allowed_modes": [
          "single",
          "warm-standby",
          "quorum"
        ]
      },
      "capabilities": {
        "required": [
          "topology-core",
          "host-bootstrap",
          "external-host-admission",
          "host-conformance",
          "security-baseline",
          "human-identity-core",
          "device-trust-core",
          "access-policy",
          "runtime-paas",
          "service-catalog",
          "secrets-recovery",
          "storage-data-policy",
          "backup-core",
          "observability-evidence",
          "lifecycle-update",
          "site-local",
          "site-cloud",
          "site-federation",
          "inter-site-link",
          "service-publication",
          "host-local-internet-firewall",
          "internet-host-hardening",
          "public-edge",
          "public-dns",
          "public-tls",
          "bridge-policy",
          "private-remote-access",
          "outbound-control-agent",
          "edge-identity-verifier",
          "local-control-authority",
          "device-enrollment-home",
          "local-ingress",
          "local-backup-target",
          "local-backup-runtime",
          "lan-access-policy",
          "offline-autonomy",
          "home-host-security",
          "cross-site-placement",
          "data-residency",
          "split-horizon-naming",
          "cross-site-backup",
          "partition-failure-contract",
          "bridge-observability"
        ],
        "defaults": [],
        "optional": [
          "lan-discovery",
          "lan-dns",
          "internal-pki",
          "private-admin-mesh",
          "failure-domain-placement",
          "telemetry-collection",
          "availability-ha"
        ],
        "forbidden": [
          "cloud-enrollment-authority",
          "broad-lan-route-advertisement"
        ]
      },
      "contexts": [],
      "source_path": "modern-homelab/stackfile.cue"
    }
  ],
  "mode_matrix": {
    "levels": [
      "supported",
      "scaffolding",
      "unsupported",
      "control-plane"
    ],
    "paas_statuses": [
      "default",
      "supported",
      "draft",
      "experimental"
    ],
    "note": "Declared per kit in <kit>/mode_matrix.cue (#KitModeSupport). 'supported' requires cited evidence; managed-serverless cells are schema-forced to control-plane in OSS. The context axis is legacy-v1 compatibility evidence only; it never identifies a kit or selects canonical Architecture v2 behavior.",
    "kits": {
      "basement-kit": {
        "kit": "basement-kit",
        "placement": {
          "local-only": "scaffolding",
          "standard": "scaffolding",
          "managed-serverless": "control-plane"
        },
        "install": {
          "bare": "scaffolding",
          "bootstrapped": "scaffolding",
          "advanced": "supported"
        },
        "context": {
          "local": "scaffolding",
          "cloud": "unsupported",
          "pi": "scaffolding"
        },
        "paas": {
          "coolify": "draft",
          "komodo": "draft",
          "dokploy": "draft",
          "dockge": "experimental"
        },
        "evidence": {
          "install.advanced": [
            "tsl_339d8557e0"
          ]
        }
      },
      "cloud-kit": {
        "kit": "cloud-kit",
        "placement": {
          "local-only": "unsupported",
          "standard": "scaffolding",
          "managed-serverless": "control-plane"
        },
        "install": {
          "bare": "scaffolding",
          "bootstrapped": "scaffolding",
          "advanced": "scaffolding"
        },
        "context": {
          "local": "unsupported",
          "cloud": "scaffolding",
          "pi": "unsupported"
        },
        "paas": {
          "coolify": "draft",
          "komodo": "draft",
          "dokploy": "draft"
        }
      },
      "modern-homelab": {
        "kit": "modern-homelab",
        "placement": {
          "local-only": "unsupported",
          "standard": "scaffolding",
          "managed-serverless": "control-plane"
        },
        "install": {
          "bare": "unsupported",
          "bootstrapped": "unsupported",
          "advanced": "scaffolding"
        },
        "context": {
          "local": "scaffolding",
          "cloud": "scaffolding",
          "pi": "scaffolding"
        },
        "paas": {}
      }
    }
  },
  "modules": [
    {
      "slug": "adguard-home",
      "display_name": "adguard-home",